Symbol,Name,Last Sale,Net Change,% Change,Market Cap,Country,IPO Year,Volume,Sector,Industry
KTTA,Pasithea Therapeutics Corp. Common Stock,$1.24,0.01,0.813%,33106373.00,United States,2021,87379,Health Care,Biotechnology: Pharmaceutical Preparations
KTTAW,Pasithea Therapeutics Corp. Warrant,$0.0756,-0.0243,-24.324%,0.00,United States,2021,9302,Health Care,Biotechnology: Pharmaceutical Preparations
KURA,Kura Oncology Inc. Common Stock,$14.30,-0.24,-1.651%,956569943.00,United States,,878574,Health Care,Biotechnology: Biological Products (No Diagnostic Substances)
KVHI,KVH Industries Inc. Common Stock,$8.89,0.08,0.908%,169577275.00,United States,1996,12874,Technology,Radio And Television Broadcasting And Communications Equipment
KVSA,Khosla Ventures Acquisition Co. Class A Common Stock,$9.835,-0.005,-0.051%,398219150.00,United States,2021,14065,Industrials,Consumer Electronics/Appliances
KVSC,Khosla Ventures Acquisition Co. III Class A Common Stock,$9.85,0.00,0.00%,618154726.00,United States,2021,800558,Industrials,Consumer Electronics/Appliances
KXIN,Kaixin Auto Holdings Ordinary Shares,$0.68,-0.0165,-2.369%,134160731.00,China,2017,43962,Finance,Business Services
KYCH,Keyarch Acquisition Corporation Ordinary Shares,$9.99,0.02,0.201%,151048800.00,United States,2022,645,Finance,Business Services
KYCHR,Keyarch Acquisition Corporation Rights,$0.11,0.00,0.00%,0.00,United States,2022,5,Finance,Business Services
KYCHU,Keyarch Acquisition Corporation Unit,$10.03,-0.02,-0.199%,0.00,United States,2022,251,Finance,Business Services
KYMR,Kymera Therapeutics Inc. Common Stock,$19.57,-0.74,-3.644%,1070591645.00,United States,2020,473946,Health Care, Medicinal Chemicals and Botanical Products 
KZIA,Kazia Therapeutics Limited American Depositary Shares,$1.05,-0.015,-1.408%,15789483.00,Australia,,13790,Health Care,Biotechnology: Pharmaceutical Preparations
KZR,Kezar Life Sciences Inc. Common Stock,$7.65,-0.02,-0.261%,523026905.00,United States,2018,616901,Health Care,Biotechnology: Pharmaceutical Preparations
LAAA,Lakeshore Acquisition I Corp. Ordinary Shares,$10.07,0.00,0.00%,71450930.00,China,2021,49,Finance,Business Services
LAAAW,Lakeshore Acquisition I Corp. Warrant,$0.12,-0.0548,-31.35%,0.00,China,2021,18157,Finance,Business Services
LAB,Standard BioTools Inc. Common Stock,$1.10,-0.07,-5.983%,86520282.00,United States,2011,115973,Industrials,Biotechnology: Laboratory Analytical Instruments
LABP,Landos Biopharma Inc. Common Stock,$0.63,-0.0195,-3.002%,25360581.00,United States,2021,9342,Health Care, Medicinal Chemicals and Botanical Products 
LAKE,Lakeland Industries Inc. Common Stock,$11.87,0.06,0.508%,89199786.00,United States,1986,93714,,
LAMR,Lamar Advertising Company Class A Common Stock,$83.78,-1.32,-1.551%,8506568956.00,United States,1996,449419,Real Estate,Real Estate Investment Trusts
LANC,Lancaster Colony Corporation Common Stock,$160.10,2.59,1.644%,4405952000.00,United States,,101034,Consumer Staples,Packaged Foods
LAND,Gladstone Land Corporation Common Stock,$17.54,-0.59,-3.254%,600043628.00,United States,2013,212155,Real Estate,Real Estate Investment Trusts
LANDM,Gladstone Land Corporation 5.00% Series D Cumulative Term Preferred Stock,$24.1079,-0.2391,-0.982%,581058394.00,United States,,1298,Real Estate,Real Estate Investment Trusts
LANDO,Gladstone Land Corporation 6.00% Series B Cumulative Redeemable Preferred Stock,$25.29,-0.11,-0.433%,0.00,United States,,21503,Real Estate,Real Estate Investment Trusts
LARK,Landmark Bancorp Inc. Common Stock,$25.30,-0.23,-0.901%,125901503.00,United States,,747,Finance,Major Banks
LASE,Laser Photonics Corporation Common Stock,$1.87,-0.39,-17.257%,14732640.00,United States,2022,634165,Industrials,Industrial Machinery/Components
LASR,nLIGHT Inc. Common Stock,$9.42,-0.07,-0.738%,424799789.00,United States,2018,234153,Technology,Semiconductors
LATG,LatAmGrowth SPAC Class A Ordinary Shares,$10.08,0.01,0.099%,163800000.00,Mexico,2022,1599,Finance,Business Services
LATGU,LatAmGrowth SPAC Unit,$10.10,-0.02,-0.198%,0.00,Mexico,2022,4360,Finance,Business Services
LATGW,LatAmGrowth SPAC Warrants,$0.10,0.00,0.00%,0.00,Mexico,2022,500,Finance,Business Services
LAUR,Laureate Education Inc. Common Stock,$10.70,0.10,0.943%,1761897610.00,United States,2017,623012,Consumer Discretionary,Service to the Health Industry
LAX,8i Acquisition 2 Corp. Ordinary Shares,$10.01,0.00,0.00%,110845735.00,Singapore,2021,3,Finance,Business Services
LAXXR,8i Acquisition 2 Corp. Rights,$0.40,-0.0143,-3.452%,0.00,Singapore,2021,108405,,
LAXXU,8i Acquisition 2 Corp. Unit,$10.20,0.00,0.00%,0.00,Singapore,2021,2,Finance,Business Services
LAXXW,8i Acquisition 2 Corp. Warrant,$0.55,0.03,5.769%,0.00,Singapore,2021,27750,Finance,Business Services
LAZR,Luminar Technologies Inc.  Class A Common Stock,$7.00,-0.33,-4.502%,2505172992.00,United States,2019,5500963,Consumer Discretionary,Auto Parts:O.E.M.
LAZY,Lazydays Holdings Inc. Common Stock,$12.73,-0.02,-0.157%,139445362.00,United States,,65013,Consumer Discretionary,Other Specialty Stores
LBAI,Lakeland Bancorp Inc. Common Stock,$16.03,0.10,0.628%,1038519612.00,United States,,384623,Finance,Major Banks
LBBB,Lakeshore Acquisition II Corp. Ordinary Shares,$10.05,-0.02,-0.199%,91872075.00,United States,2022,500500,Finance,Business Services
LBBBR,Lakeshore Acquisition II Corp. Rights,$0.19,0.02,11.765%,0.00,United States,2022,620,Finance,Business Services
LBBBU,Lakeshore Acquisition II Corp. Unit,$10.24,-0.01,-0.098%,0.00,United States,2022,532,Finance,Business Services
LBBBW,Lakeshore Acquisition II Corp. Warrants,$0.08,-0.03,-27.273%,0.00,United States,2022,25102,Finance,Business Services
LBC,Luther Burbank Corporation Common Stock,$11.61,-0.05,-0.429%,592979252.00,United States,2003,30111,Finance,Commercial Banks
LBPH,Longboard Pharmaceuticals Inc. Common Stock,$3.34,-0.28,-7.735%,57499269.00,United States,2021,8482,Health Care,Biotechnology: Pharmaceutical Preparations
LBRDA,Liberty Broadband Corporation Class A Common Stock,$77.57,0.32,0.414%,11929077860.00,United States,,154519,Consumer Discretionary,Telecommunications Equipment
LBRDK,Liberty Broadband Corporation Class C Common Stock,$76.37,0.49,0.646%,11744536241.00,United States,,901445,Consumer Discretionary,Telecommunications Equipment
LBRDP,Liberty Broadband Corporation Series A Cumulative Redeemable Preferred Stock,$23.9528,-0.0272,-0.113%,0.00,United States,,6576,Consumer Discretionary,Telecommunications Equipment
LBTYA,Liberty Global plc Class A Ordinary Shares,$15.86,-0.14,-0.875%,7688827511.00,United Kingdom,,1328225,Telecommunications,Cable & Other Pay Television Services
LBTYB,Liberty Global plc Class B Ordinary Shares,$16.752,-0.528,-3.056%,8121263459.00,United Kingdom,,530,Telecommunications,Cable & Other Pay Television Services
LBTYK,Liberty Global plc Class C Ordinary Shares,$16.77,-0.14,-0.828%,8129989745.00,United Kingdom,,1850201,Telecommunications,Cable & Other Pay Television Services
LCA,Landcadia Holdings IV Inc. Class A Common Stock,$9.84,-0.02,-0.203%,615000000.00,United States,2021,12503,Industrials,Consumer Electronics/Appliances
LCAA,L Catterton Asia Acquisition Corp Class A Ordinary Shares,$9.92,-0.01,-0.101%,355270833.00,Singapore,2021,650015,Finance,Business Services
LCAAU,L Catterton Asia Acquisition Corp Units,$9.9252,0.0252,0.255%,0.00,Singapore,2021,220,Finance,Business Services
LCAAW,L Catterton Asia Acquisition Corp Warrant,$0.0301,-0.0199,-39.80%,0.00,Singapore,2021,2000,Finance,Business Services
LCAHW,Landcadia Holdings IV Inc. Warrant ,$0.12,-0.005,-4.00%,0.00,United States,2021,198663,Industrials,Consumer Electronics/Appliances
LCFY,Locafy Limited Ordinary Share,$0.48,-0.02,-4.00%,9853825.00,Australia,2022,51205,,
LCID,Lucid Group Inc. Common Stock,$12.48,-0.69,-5.239%,20939301415.00,United States,,20728788,Consumer Discretionary,Auto Manufacturing
LCNB,LCNB Corporation Common Stock,$15.79,-0.23,-1.436%,179299398.00,United States,,15119,Finance,Major Banks
LCUT,Lifetime Brands Inc. Common Stock,$6.50,-0.35,-5.109%,143372177.00,United States,1991,25173,Consumer Discretionary,Home Furnishings
LDHA,LDH Growth Corp I Class A Ordinary Shares,$9.93,0.00,0.00%,285487500.00,United States,2021,35,Finance,Business Services
LDHAU,LDH Growth Corp I Units,$9.91,0.01,0.101%,0.00,United States,2021,100,Finance,Business Services
LDHAW,LDH Growth Corp I Warrant,$0.0202,-0.0026,-11.404%,0.00,United States,2021,201,Finance,Business Services
LE,Lands' End Inc. Common Stock,$9.19,0.51,5.876%,304322834.00,United States,,116754,Consumer Discretionary,Clothing/Shoe/Accessory Stores
LECO,Lincoln Electric Holdings Inc. Common Shares,$122.44,-1.60,-1.29%,7091643622.00,United States,,356482,Industrials,Industrial Machinery/Components
LEDS,SemiLEDS Corporation Common Stock,$2.49,-0.12,-4.598%,11280083.00,Taiwan,2010,4634,Technology,Semiconductors
LEE,Lee Enterprises Incorporated Common Stock,$18.95,-0.12,-0.629%,113270119.00,United States,,24199,Consumer Discretionary,Newspapers/Magazines
LEGA,Lead Edge Growth Opportunities Ltd Class A Ordinary Shares,$9.91,0.00,0.00%,427368750.00,United States,2021,109,Finance,Business Services
LEGAU,Lead Edge Growth Opportunities Ltd Units,$9.9189,0.0089,0.09%,0.00,United States,2021,635,Finance,Business Services
LEGAW,Lead Edge Growth Opportunities Ltd Warrant,$0.03,-0.007,-18.919%,0.00,United States,2021,28448,Finance,Business Services
LEGH,Legacy Housing Corporation Common Stock (TX),$16.88,0.18,1.078%,411973618.00,United States,2018,33535,Consumer Discretionary,Homebuilding
LEGN,Legend Biotech Corporation American Depositary Shares,$39.00,-1.08,-2.695%,6528708888.00,United States,2020,547405,Health Care,Biotechnology: Pharmaceutical Preparations
LESL,Leslie's Inc. Common Stock,$14.51,-0.11,-0.752%,2655731695.00,United States,2020,1792679,Miscellaneous,Diversified Commercial Services
LEXX,Lexaria Bioscience Corp. Common Stock,$2.00,-0.21,-9.502%,11901996.00,Canada,,71830,Health Care,Biotechnology: Pharmaceutical Preparations
LEXXW,Lexaria Bioscience Corp. Warrant,$0.3387,-0.1028,-23.284%,0.00,Canada,,6618,Health Care,Biotechnology: Pharmaceutical Preparations
LFAC,LF Capital Acquisition Corp. II Class A Common Stock,$10.07,-0.01,-0.099%,325701563.00,United States,2022,100,Industrials,Consumer Electronics/Appliances
LFLY,Leafly Holdings Inc. Common Stock,$0.626,-0.0934,-12.983%,24967380.00,United States,2019,687587,Consumer Staples,Retail-Drug Stores and Proprietary Stores
LFLYW,Leafly Holdings Inc. Warrant,$0.14,-0.02,-12.50%,0.00,United States,2019,6599,Consumer Staples,Retail-Drug Stores and Proprietary Stores
LFMD,LifeMD Inc. Common Stock,$2.12,-0.01,-0.469%,65615227.00,United States,,75746,Miscellaneous,Diversified Commercial Services
LFMDP,LifeMD Inc. 8.875% Series A Cumulative Perpetual Preferred Stock,$13.98,0.00,0.00%,0.00,United States,,1114,Miscellaneous,Diversified Commercial Services
LFST,LifeStance Health Group Inc. Common Stock,$7.64,0.13,1.731%,2874027248.00,United States,2021,489707,Health Care,Hospital/Nursing Management
LFTR,Lefteris Acquisition Corp. Class A Common Stock,$10.04,0.02,0.20%,259909165.00,United States,2020,8485,Industrials,Consumer Electronics/Appliances
LFTRU,Lefteris Acquisition Corp. Unit,$10.01,-0.0243,-0.242%,0.00,United States,2020,17979,Industrials,Consumer Electronics/Appliances
LFTRW,Lefteris Acquisition Corp. Warrant,$0.0099,-0.0001,-1.00%,0.00,United States,2020,37575,Industrials,Consumer Electronics/Appliances
LFUS,Littelfuse Inc. Common Stock,$202.03,-2.08,-1.019%,5001234467.00,United States,,58767,Technology,Electronic Components
LFVN,Lifevantage Corporation Common Stock (Delaware),$3.75,-0.08,-2.089%,47100131.00,United States,,33341,Consumer Staples,Farming/Seeds/Milling
LGAC,Lazard Growth Acquisition Corp. I Ordinary Shares,$9.95,0.02,0.201%,715156250.00,,2021,425338,Finance,Business Services
LGACU,Lazard Growth Acquisition Corp. I Units,$9.94,0.01,0.101%,0.00,,2021,13839,Finance,Business Services
LGACW,Lazard Growth Acquisition Corp. I Warrants,$0.04,0.0101,33.779%,0.00,,2021,1000,Finance,Business Services
LGHL,Lion Group Holding Ltd. American Depositary Share,$1.01,0.00,0.00%,47591239.00,China,,496045,Finance,Investment Bankers/Brokers/Service
LGHLW,Lion Group Holding Ltd. Warrant,$0.0709,0.0068,10.608%,0.00,China,,4400,Finance,Investment Bankers/Brokers/Service
LGIH,LGI Homes Inc. Common Stock,$87.37,0.02,0.023%,2033327674.00,United States,2013,154242,Consumer Discretionary,Homebuilding
LGMK,LogicMark Inc. Common Stock,$0.9198,0.0897,10.806%,8838300.00,United States,,37388,Consumer Discretionary,Diversified Commercial Services
LGND,Ligand Pharmaceuticals Incorporated Common Stock,$92.46,-1.66,-1.764%,1560979157.00,United States,,79569,Health Care,Biotechnology: Pharmaceutical Preparations
LGO,Largo Inc. Common Shares,$5.68,0.04,0.709%,364258400.00,Canada,,34851,,
LGST,Semper Paratus Acquisition Corporation Class A Ordinary Shares,$10.15,0.00,0.00%,486523330.00,United States,2022,204,Finance,Business Services
LGSTU,Semper Paratus Acquisition Corporation Unit,$10.16,0.00,0.00%,0.00,United States,2021,1200,Finance,Business Services
LGSTW,Semper Paratus Acquisition Corporation Warrant,$0.06,-0.01,-14.286%,0.00,United States,2022,600,Finance,Business Services
LGTO,Legato Merger Corp. II Common Stock,$9.93,0.00,0.00%,356596230.00,United States,2021,44,Industrials,Consumer Electronics/Appliances
LGTOW,Legato Merger Corp. II Warrants,$0.3699,0.0098,2.721%,0.00,United States,2021,4000,Industrials,Consumer Electronics/Appliances
LGVC,LAMF Global Ventures Corp. I Class A Ordinary Shares,$10.06,-0.04,-0.396%,350483690.00,United States,2021,376365,,
LGVCU,LAMF Global Ventures Corp. I Unit,$10.08,-0.13,-1.273%,0.00,United States,2021,8400,,
LGVCW,LAMF Global Ventures Corp. I Warrant,$0.1118,-0.0382,-25.467%,0.00,United States,2021,2100,,
LGVN,Longeveron Inc. Class A Common Stock,$3.42,-0.08,-2.286%,71775608.00,United States,2021,52852,Health Care, Medicinal Chemicals and Botanical Products 
LHAA,Lerer Hippeau Acquisition Corp. Class A Common Stock,$9.86,0.00,0.00%,281188022.00,United States,2021,17,Industrials,Consumer Electronics/Appliances
LHCG,LHC Group Common Stock,$164.80,-0.14,-0.085%,5113549866.00,United States,2005,306461,Health Care,Medical/Nursing Services
LHDX,Lucira Health Inc. Common Stock,$1.01,-0.08,-7.339%,40507560.00,United States,2021,31453,Health Care,Biotechnology: Electromedical & Electrotherapeutic Apparatus
LI,Li Auto Inc. American Depositary Shares,$19.00,-0.57,-2.913%,18539288969.00,China,2020,10797296,Consumer Discretionary,Auto Manufacturing
LIAN,LianBio American Depositary Shares,$1.93,-0.01,-0.515%,209122894.00,United States,2021,88332,Health Care,Biotechnology: Pharmaceutical Preparations
LIBY,Liberty Resources Acquisition Corp. Class A Common Stock,$10.07,-0.01,-0.099%,150096119.00,United States,2021,8100,Industrials,Consumer Electronics/Appliances
LIBYU,Liberty Resources Acquisition Corp. Unit,$10.10,0.00,0.00%,0.00,United States,2021,100,Industrials,Consumer Electronics/Appliances
LIBYW,Liberty Resources Acquisition Corp. Warrant,$0.0772,0.00,0.00%,0.00,United States,2021,1034,Industrials,Consumer Electronics/Appliances
LIDR,AEye Inc. Class A Common Stock,$1.14,-0.03,-2.564%,183312214.00,United States,2021,382048,Consumer Discretionary,Auto Parts:O.E.M.
LIDRW,AEye Inc. Warrant,$0.1899,0.0275,16.933%,0.00,United States,2021,1400,Consumer Discretionary,Auto Parts:O.E.M.
LIFE,aTyr Pharma Inc. Common Stock,$2.735,0.005,0.183%,78289501.00,United States,2015,197244,Health Care,Biotechnology: Biological Products (No Diagnostic Substances)
LILA,Liberty Latin America Ltd. Class A Common Stock,$7.51,0.32,4.451%,1663295169.00,United States,,199870,Telecommunications,Cable & Other Pay Television Services
LILAK,Liberty Latin America Ltd. Class C Common Stock,$7.52,0.35,4.881%,1665509943.00,United States,,1924614,Telecommunications,Cable & Other Pay Television Services
LILM,Lilium N.V. Class A Ordinary Shares,$1.78,-0.19,-9.645%,533438040.00,Germany,,1433610,Industrials,Aerospace
LILMW,Lilium N.V. Warrants,$0.1721,-0.0179,-9.421%,0.00,Germany,,28908,Industrials,Aerospace
LINC,Lincoln Educational Services Corporation Common Stock,$5.31,-0.12,-2.21%,142411550.00,United States,2005,89320,Consumer Discretionary,Service to the Health Industry
LIND,Lindblad Expeditions Holdings Inc. Common Stock,$6.59,-0.58,-8.089%,349694238.00,United States,2013,260186,,
LINK,Interlink Electronics Inc. Common Stock,$8.65,0.26,3.099%,57127178.00,United States,,613,Technology,Industrial Machinery/Components
LION,Lionheart III Corp Class A Common Stock,$10.09,0.0026,0.026%,161692250.00,United States,2021,13273,Industrials,Consumer Electronics/Appliances
LIONW,Lionheart III Corp Warrant,$0.0298,-0.012,-28.708%,0.00,United States,2021,1600,Industrials,Consumer Electronics/Appliances
LIQT,LiqTech International Inc. Common Stock,$0.4359,0.0347,8.649%,19134646.00,Denmark,,109374,Industrials,Industrial Machinery/Components
LITE,Lumentum Holdings Inc. Common Stock,$72.11,-0.59,-0.812%,4915465619.00,United States,,653147,Technology,Computer peripheral equipment
LITM,Snow Lake Resources Ltd. Common Shares,$2.28,-0.44,-16.176%,40868448.00,Canada,2021,782231,,
LITT,Logistics Innovation Technologies Corp. Class A Common Stock,$9.80,0.01,0.102%,417597737.00,United States,2021,2701,Industrials,Consumer Electronics/Appliances
LITTU,Logistics Innovation Technologies Corp. Units,$9.82,0.02,0.204%,0.00,United States,2021,100,Industrials,Consumer Electronics/Appliances
LITTW,Logistics Innovation Technologies Corp. Warrant,$0.0501,-0.0029,-5.472%,0.00,United States,2021,8576,Industrials,Consumer Electronics/Appliances
LIVB,LIV Capital Acquisition Corp. II Class A Ordinary Shares,$10.0701,0.0301,0.30%,145739522.00,Mexico,2022,102,Finance,Business Services
LIVBU,LIV Capital Acquisition Corp. II Unit,$10.13,0.00,0.00%,0.00,Mexico,2022,158,Finance,Business Services
LIVE,Live Ventures Incorporated Common Stock,$25.00,0.01,0.04%,76991400.00,United States,,8245,,
LIVN,LivaNova PLC Ordinary Shares,$48.93,0.43,0.887%,2619992716.00,United Kingdom,,305356,Health Care,Biotechnology: Electromedical & Electrotherapeutic Apparatus
LIXT,Lixte Biotechnology Holdings Inc. Common Stock,$0.60,0.0347,6.138%,9987956.00,United States,,19811,Health Care,Biotechnology: Pharmaceutical Preparations
LIXTW,Lixte Biotechnology Holdings Inc. Warrants,$0.07,0.00,0.00%,0.00,United States,,6767,Health Care,Biotechnology: Pharmaceutical Preparations
LIZI,LIZHI INC. American Depositary Shares,$0.551,-0.011,-1.957%,28105997.00,China,2020,62989,Technology,Computer Software: Programming Data Processing
LJAQ,LightJump Acquisition Corporation Common Stock,$10.09,0.01,0.099%,108069288.00,United States,2021,103,Industrials,Consumer Electronics/Appliances
LJAQU,LightJump Acquisition Corporation Unit,$10.10,0.02,0.198%,0.00,United States,2021,280,Industrials,Consumer Electronics/Appliances
LJAQW,LightJump Acquisition Corporation Warrant,$0.06,0.00,0.00%,0.00,United States,2021,36,Industrials,Consumer Electronics/Appliances
LKCO,Luokung Technology Corp Ordinary Shares,$0.1698,-0.0026,-1.508%,72624970.00,China,,505482,Technology,EDP Services
LKFN,Lakeland Financial Corporation Common Stock,$73.83,1.07,1.471%,1871713205.00,United States,,73853,Finance,Major Banks
LKQ,LKQ Corporation Common Stock,$49.72,0.37,0.75%,13642669706.00,United States,2003,929931,Consumer Discretionary,Automotive Aftermarket
LLL,JX Luxventure Limited,$0.8391,-0.0384,-4.376%,2174359.00,China,2013,46058,Consumer Staples,Apparel
LMACA,Liberty Media Acquisition Corporation Series A Common Stock,$9.95,0.00,0.00%,715156250.00,United States,2021,151294,Industrials,Consumer Electronics/Appliances
LMACU,Liberty Media Acquisition Corporation Unit,$9.95,0.00,0.00%,0.00,United States,2021,4368,Industrials,Consumer Electronics/Appliances
LMACW,Liberty Media Acquisition Corporation Warrants,$0.004,0.0005,14.286%,0.00,United States,2021,96136,Industrials,Consumer Electronics/Appliances
LMAO,LMF Acquisition Opportunities Inc. Class A common stock,$10.30,0.01,0.097%,134322300.00,United States,2021,3032,Industrials,Consumer Electronics/Appliances
LMAOU,LMF Acquisition Opportunities Inc. Unit,$10.35,-0.10,-0.957%,0.00,United States,2021,1314,Industrials,Consumer Electronics/Appliances
LMAOW,LMF Acquisition Opportunities Inc. Warrant,$0.095,-0.0025,-2.564%,0.00,United States,2021,1945,Industrials,Consumer Electronics/Appliances
LMAT,LeMaitre Vascular Inc. Common Stock,$48.24,-0.33,-0.679%,1059488801.00,United States,2006,61314,Health Care,Medical/Dental Instruments
LMB,Limbach Holdings Inc. Common Stock,$7.75,0.06,0.78%,80969365.00,United States,,27015,Consumer Discretionary,Military/Government/Technical
LMDX,LumiraDx Limited Common Shares,$0.909,-0.0632,-6.501%,229703979.00,Cayman Islands,,161034,Health Care,Biotechnology: In Vitro & In Vivo Diagnostic Substances
LMDXW,LumiraDx Limited Warrant,$0.1097,0.0111,11.258%,0.00,Cayman Islands,,180,Health Care,Biotechnology: In Vitro & In Vivo Diagnostic Substances
LMFA,LM Funding America Inc. Common Stock,$0.9654,0.0252,2.68%,12638904.00,United States,2015,12119,Finance,Finance: Consumer Services
LMNL,Liminal BioSciences Inc. Common Shares,$0.4709,0.0108,2.347%,14617942.00,Canada,,44407,Health Care,Pharmaceuticals and Biotechnology
LMNR,Limoneira Co Common Stock,$12.31,-0.26,-2.068%,218152293.00,United States,,10739,Consumer Staples,Farming/Seeds/Milling
LMST,Limestone Bancorp Inc. Common Stock,$19.32,0.00,0.00%,147601245.00,United States,2006,155,Finance,Major Banks
LNDC,Landec Corporation Common Stock (DE),$8.05,-0.19,-2.306%,238244210.00,United States,1996,65416,Health Care,Biotechnology: Pharmaceutical Preparations
LNKB,LINKBANCORP Inc. Common Stock,$7.53,0.00,0.00%,112495489.00,United States,,27350,,
LNSR,LENSAR Inc. Common Stock,$5.25,0.15,2.941%,57860066.00,United States,,1773,Health Care,Medical Electronics
LNT,Alliant Energy Corporation Common Stock,$49.87,0.22,0.443%,12513691190.00,United States,,1625042,Utilities,Power Generation
LNTH,Lantheus Holdings Inc. Common Stock,$66.23,0.79,1.207%,4552775110.00,United States,2015,1923866,Health Care,Biotechnology: Pharmaceutical Preparations
LNW,Light & Wonder Inc. Common Stock,$46.19,-0.92,-1.953%,4357088797.00,United States,,589687,Consumer Discretionary,Movies/Entertainment
LOAN,Manhattan Bridge Capital Inc,$5.25,-0.35,-6.25%,60348461.00,United States,,74544,Real Estate,Real Estate Investment Trusts
LOB,Live Oak Bancshares Inc. Common Stock,$33.22,-0.57,-1.687%,1457466807.00,United States,2015,175312,Finance,Commercial Banks
LOCO,El Pollo Loco Holdings Inc. Common Stock,$9.19,0.18,1.998%,340053094.00,United States,2014,69341,Consumer Discretionary,Restaurants
LOGC,LogicBio Therapeutics Inc. Common Stock,$2.03,0.00,0.00%,66914348.00,United States,2018,511436,Health Care,Biotechnology: Biological Products (No Diagnostic Substances)
LOGI,Logitech International S.A. Ordinary Shares,$44.30,0.28,0.636%,7248864021.00,United States,1997,818114,Technology,Computer peripheral equipment
LOOP,Loop Industries Inc. Common Stock,$3.59,0.08,2.279%,170168545.00,Canada,,105795,,
LOPE,Grand Canyon Education Inc. Common Stock,$80.21,-0.63,-0.779%,2563751829.00,United States,2008,275693,Consumer Discretionary,Service to the Health Industry
LOTZ,CarLotz Inc. Class A Common Stock,$0.2685,-0.0147,-5.191%,30799017.00,United States,2019,588758,Consumer Discretionary,Other Specialty Stores
LOTZW,CarLotz Inc. Warrant,$0.0346,-0.0046,-11.735%,0.00,United States,2019,130735,Consumer Discretionary,Other Specialty Stores
LOV,Spark Networks SE American Depositary Shares ,$1.91,0.04,2.139%,49992283.00,Germany,,109496,Consumer Discretionary,Other Consumer Services
LOVE,The Lovesac Company Common Stock,$20.06,-0.25,-1.231%,304598201.00,United States,2018,429372,,
LPCN,Lipocine Inc. Common Stock,$0.434,-0.021,-4.615%,38413683.00,United States,,88799,Health Care,Biotechnology: Pharmaceutical Preparations
LPLA,LPL Financial Holdings Inc. Common Stock,$243.99,1.51,0.623%,19463030574.00,United States,2010,1034244,Finance,Investment Bankers/Brokers/Service
LPRO,Open Lending Corporation Class A Common Stock,$7.28,-0.13,-1.754%,841931338.00,United States,,1003932,Finance,Finance: Consumer Services
LPSN,LivePerson Inc. Common Stock,$9.09,-0.88,-8.826%,681862280.00,United States,2000,888650,Technology,EDP Services
LPTH,LightPath Technologies Inc. Class A Common Stock,$1.06,-0.01,-0.935%,28696245.00,United States,1996,16105,Technology,Electronic Components
LPTX,Leap Therapeutics Inc. Common Stock,$0.87,0.0189,2.221%,86148597.00,United States,,738188,Health Care,Biotechnology: Biological Products (No Diagnostic Substances)
LQDA,Liquidia Corporation Common Stock,$5.28,-0.16,-2.941%,339833134.00,United States,2018,431783,Health Care,Biotechnology: Biological Products (No Diagnostic Substances)
LQDT,Liquidity Services Inc. Common Stock,$17.33,0.34,2.001%,616679142.00,United States,2006,85755,Consumer Discretionary,Catalog/Specialty Distribution
LRCX,Lam Research Corporation Common Stock,$350.72,-24.12,-6.435%,47990605660.00,United States,1984,3949914,Technology,Industrial Machinery/Components
LRFC,Logan Ridge Finance Corporation Common Stock,$18.12,-0.32,-1.735%,49124552.00,United States,2013,1444,Finance,Trusts Except Educational Religious and Charitable
LRMR,Larimar Therapeutics Inc. Common Stock,$3.12,-0.04,-1.266%,134999904.00,United States,2014,41440,Health Care,Biotechnology: Pharmaceutical Preparations
LSAK,Lesaka Technologies Inc. Common Stock,$4.04,0.00,0.00%,239487063.00,South Africa,,16695,Technology,EDP Services
LSBK,Lake Shore Bancorp Inc. Common Stock,$13.48,-0.01,-0.074%,76938273.00,United States,2006,381,Finance,Savings Institutions
LSCC,Lattice Semiconductor Corporation Common Stock,$49.29,-2.03,-3.956%,6768344382.00,United States,,1450005,Technology,Semiconductors
LSEA,Landsea Homes Corporation Common Stock,$4.69,-0.08,-1.677%,191940966.00,United States,2018,46427,,
LSEAW,Landsea Homes Corporation Warrant,$0.15,-0.0027,-1.768%,0.00,United States,2018,6200,,
