Symbol,Name,Last Sale,Net Change,% Change,Market Cap,Country,IPO Year,Volume,Sector,Industry
DHCAU,DHC Acquisition Corp. Unit,$9.95,0.03,0.302%,0.00,United States,2021,4533,Finance,Business Services
DHCAW,DHC Acquisition Corp. Warrant,$0.1002,0.0001,0.10%,0.00,United States,2021,32444,Finance,Business Services
DHCNI,Diversified Healthcare Trust 5.625% Senior Notes due 2042,$12.30,0.62,5.308%,0.00,United States,,33454,Real Estate,Real Estate Investment Trusts
DHCNL,Diversified Healthcare Trust 6.25% Senior Notes Due 2046,$12.66,0.46,3.77%,0.00,United States,,49623,Real Estate,Real Estate Investment Trusts
DHHC,DiamondHead Holdings Corp. Class A Common Stock,$9.88,0.01,0.101%,426075000.00,United States,2021,10374,Industrials,Consumer Electronics/Appliances
DHHCU,DiamondHead Holdings Corp. Unit,$9.90,-0.01,-0.101%,0.00,United States,2021,10008,Industrials,Consumer Electronics/Appliances
DHHCW,DiamondHead Holdings Corp. Warrant,$0.2008,-0.0296,-12.847%,0.00,United States,2021,71960,Industrials,Consumer Electronics/Appliances
DHIL,Diamond Hill Investment Group Inc. Class A Common Stock,$162.75,1.24,0.768%,504340604.00,United States,,10117,Finance,Investment Managers
DIBS,1stdibs.com Inc. Common Stock,$6.28,0.21,3.46%,242366772.00,United States,2021,129585,Miscellaneous,Diversified Commercial Services
DICE,DICE Therapeutics Inc. Common Stock,$24.65,1.98,8.734%,941896861.00,United States,2021,1090893,Health Care,Biotechnology: Pharmaceutical Preparations
DILA,DILA Capital Acquisition Corp. Class A Common Stock,$9.93,0.00,0.00%,75264187.00,Mexico,2021,20,Industrials,Consumer Electronics/Appliances
DILAW,DILA Capital Acquisition Corp. Warrant,$0.04,-0.01,-20.00%,0.00,Mexico,2021,500,Industrials,Consumer Electronics/Appliances
DIOD,Diodes Incorporated Common Stock,$68.85,-1.11,-1.587%,3131368640.00,United States,,352104,Technology,Semiconductors
DISA,Disruptive Acquisition Corporation I Class A Ordinary Shares,$9.93,0.02,0.202%,341343750.00,United States,2021,99891,Finance,Business Services
DISAU,Disruptive Acquisition Corporation I Unit,$9.925,0.015,0.151%,0.00,United States,2021,200,Finance,Business Services
DISAW,Disruptive Acquisition Corporation I Warrant,$0.0242,0.0034,16.346%,0.00,United States,2021,2000,Finance,Business Services
DISH,DISH Network Corporation Class A Common Stock,$14.12,0.06,0.427%,7487905202.00,United States,1995,4021809,Consumer Discretionary,Telecommunications Equipment
DJCO,Daily Journal Corp. (S.C.) Common Stock,$258.25,3.25,1.275%,355616965.00,United States,,12676,Technology,Retail: Computer Software & Peripheral Equipment
DKDCA,Data Knights Acquisition Corp. Class A Common Stock,$10.41,0.01,0.096%,155736463.00,United Kingdom,2021,2002,Industrials,Consumer Electronics/Appliances
DKDCU,Data Knights Acquisition Corp. Unit,$10.45,0.03,0.288%,0.00,United Kingdom,2021,100,Industrials,Consumer Electronics/Appliances
DKDCW,Data Knights Acquisition Corp. Warrant,$0.099,0.019,23.75%,0.00,United Kingdom,2021,2641,Industrials,Consumer Electronics/Appliances
DKNG,DraftKings Inc. Class A Common Stock,$14.28,-2.29,-13.82%,6405234510.00,United States,2019,36968600,Consumer Discretionary,Services-Misc. Amusement & Recreation
DLCA,Deep Lake Capital Acquisition Corp. Class A Ordinary Shares,$9.97,0.00,0.00%,257973750.00,United States,2021,8,Finance,Business Services
DLCAU,Deep Lake Capital Acquisition Corp. Unit,$9.96,0.00,0.00%,0.00,United States,2021,200,Finance,Business Services
DLCAW,Deep Lake Capital Acquisition Corp. Warrant,$0.0299,0.0045,17.717%,0.00,United States,2021,76307,Finance,Business Services
DLHC,DLH Holdings Corp.,$12.57,0.54,4.489%,162923151.00,United States,,42596,Consumer Discretionary,Business Services
DLO,DLocal Limited Class A Common Shares,$21.91,-0.57,-2.536%,6485033344.00,Uruguay,2021,486889,Consumer Discretionary,Business Services
DLPN,Dolphin Entertainment Inc. Common Stock,$2.6799,-0.1301,-4.63%,26119367.00,United States,,48936,Consumer Discretionary,Advertising
DLTH,Duluth Holdings Inc. Class B Common Stock,$7.10,0.05,0.709%,236982657.00,United States,2015,67058,Consumer Discretionary,Department/Specialty Retail Stores
DLTR,Dollar Tree Inc. Common Stock,$141.46,-0.49,-0.345%,31678123069.00,United States,1995,964004,Consumer Discretionary,Department/Specialty Retail Stores
DMAC,DiaMedica Therapeutics Inc. Common Stock,$1.45,0.15,11.538%,38342447.00,United States,2018,118234,Health Care,Pharmaceuticals and Biotechnology
DMAQ,Deep Medicine Acquisition Corp. Class A Common Stock,$10.08,0.00,0.00%,165646656.00,United States,2021,18,Industrials,Consumer Electronics/Appliances
DMAQR,Deep Medicine Acquisition Corp. Rights,$0.032,-0.012,-27.273%,0.00,United States,2021,10700,,
DMLP,Dorchester Minerals L.P. Common Units Representing Limited Partnership Interests,$28.30,-0.07,-0.247%,1062800104.00,United States,,95220,Energy,Oil & Gas Production
DMRC,Digimarc Corporation Common Stock,$13.14,-0.42,-3.097%,262415537.00,United States,,49827,Technology,EDP Services
DMTK,DermTech Inc. Common Stock,$3.56,-0.01,-0.28%,106942208.00,United States,2017,414468,Health Care,Managed Health Care
DNAB,Social Capital Suvretta Holdings Corp. II Class A Ordinary Shares,$9.841,0.011,0.112%,313829490.00,United States,2021,1883981,Finance,Business Services
DNAD,Social Capital Suvretta Holdings Corp. IV Class A Ordinary Shares,$9.845,0.015,0.153%,313957050.00,United States,2021,1583381,Finance,Business Services
DNAY,Codex DNA Inc. Common Stock,$1.64,0.09,5.806%,48409841.00,United States,2021,101799,Health Care,Medical Specialities
DNLI,Denali Therapeutics Inc. Common Stock,$30.67,-0.08,-0.26%,3783088313.00,United States,2017,914423,Health Care,Biotechnology: Biological Products (No Diagnostic Substances)
DNUT,Krispy Kreme Inc. Common Stock,$12.59,-0.21,-1.641%,2107922322.00,United States,2021,1088905,Consumer Discretionary,Specialty Foods
DOCU,DocuSign Inc. Common Stock,$46.27,-1.56,-3.262%,9290055851.00,United States,2018,5467876,Technology,EDP Services
DOGZ,Dogness (International) Corporation Class A Common Stock,$1.07,0.04,3.883%,42023457.00,China,2017,60325,Consumer Discretionary,Miscellaneous manufacturing industries
DOMO,Domo Inc. Class B Common Stock,$15.44,-1.99,-11.417%,529065419.00,United States,2018,484540,Technology,Computer Software: Prepackaged Software
DOOO,BRP Inc. (Recreational Products) Common Subordinate Voting Shares,$62.55,0.07,0.112%,4924554745.00,Canada,,10910,,
DORM,Dorman Products Inc. Common Stock,$88.32,2.56,2.985%,2776065850.00,United States,,81723,Consumer Discretionary,Auto Parts:O.E.M.
DOX,Amdocs Limited Ordinary Shares,$80.56,-0.71,-0.874%,9825178160.00,Guernsey,,267160,Technology,EDP Services
DOYU,DouYu International Holdings Limited ADS,$1.01,-0.08,-7.339%,320658678.00,China,2019,463170,Technology,Computer Software: Programming Data Processing
DPCS,DP Cap Acquisition Corp I Class A Ordinary Shares,$10.07,-0.02,-0.198%,289512500.00,United States,2021,37775,Finance,Business Services
DPCSW,DP Cap Acquisition Corp I Warrants,$0.06,0.01,20.00%,0.00,United States,2021,600,Finance,Business Services
DPRO,Draganfly Inc. Common Shares,$0.699,0.0355,5.35%,23213545.00,Canada,,140627,Consumer Discretionary,Electronic Components
DRAY,Macondray Capital Acquisition Corp. I Class A Ordinary Shares,$10.01,0.00,0.00%,359734375.00,United States,2021,17,Finance,Business Services
DRAYU,Macondray Capital Acquisition Corp. I Unit,$10.02,0.00,0.00%,0.00,United States,2021,100,Finance,Business Services
DRAYW,Macondray Capital Acquisition Corp. I Warrant,$0.0575,0.002,3.604%,0.00,United States,2021,15400,Finance,Business Services
DRCT,Direct Digital Holdings Inc. Class A Common Stock,$2.01,-0.06,-2.899%,28497780.00,United States,2022,8825,Consumer Discretionary,Advertising
DRCTW,Direct Digital Holdings Inc. Warrant,$0.27,0.00,0.00%,0.00,United States,2022,14,Consumer Discretionary,Advertising
DRIO,DarioHealth Corp. Common Stock,$5.27,0.11,2.132%,121100010.00,Israel,,120109,Health Care,Medical/Dental Instruments
DRMA,Dermata Therapeutics Inc. Common Stock,$0.60,0.0024,0.402%,6061328.00,United States,2021,92725,Health Care,Biotechnology: Pharmaceutical Preparations
DRMAW,Dermata Therapeutics Inc. Warrant,$0.0661,0.00,0.00%,0.00,United States,2021,113,Health Care,Biotechnology: Pharmaceutical Preparations
DRRX,DURECT Corporation Common Stock,$0.526,0.0112,2.176%,119803874.00,United States,2000,214181,Health Care,Biotechnology: Pharmaceutical Preparations
DRTS,Alpha Tau Medical Ltd. Ordinary Shares,$4.60,-0.35,-7.071%,317451897.00,Israel,,27142,Finance,Business Services
DRTSW,Alpha Tau Medical Ltd. Warrant,$0.4224,-0.0075,-1.745%,0.00,Israel,,7392,Health Care,Medical/Dental Instruments
DRTT,DIRTT Environmental Solutions Ltd. Common Shares,$0.4254,0.0207,5.115%,37005047.00,Canada,,19635,,
DRUG,Bright Minds Biosciences Inc. Common Stock,$1.00,-0.07,-6.542%,15209861.00,Canada,,386865,Health Care,Pharmaceuticals and Biotechnology
DRVN,Driven Brands Holdings Inc. Common Stock,$29.90,0.68,2.327%,5005025584.00,United States,2021,698913,,
DSEY,Diversey Holdings Ltd. Ordinary Shares,$4.45,0.10,2.299%,1442977782.00,United States,2021,693800,Consumer Discretionary,Specialty Chemicals
DSGN,Design Therapeutics Inc. Common Stock,$15.48,-0.20,-1.276%,863906834.00,United States,2021,188916,Health Care,Biotechnology: Pharmaceutical Preparations
DSGR,Distribution Solutions Group Inc. Common Stock,$27.30,-0.92,-3.26%,530841402.00,United States,,46519,Industrials,Industrial Machinery/Components
DSGX,Descartes Systems Group Inc. (The) Common Stock,$66.96,-1.79,-2.604%,5677644666.00,Canada,,83013,,
DSKE,Daseke Inc. Common Stock,$6.11,0.21,3.559%,388016735.00,United States,2015,239903,,
DSP,Viant Technology Inc. Class A Common Stock,$4.29,0.02,0.468%,61148802.00,United States,2021,38794,Technology,EDP Services
DSWL,Deswell Industries Inc. Common Shares,$3.11,0.01,0.323%,49558593.00,Macau,1995,1872,Industrials,Plastic Products
DTEA,DAVIDsTEA Inc. Common Stock,$0.8499,-0.0191,-2.198%,22574826.00,Canada,2015,17295,,
DTIL,Precision BioSciences Inc. Common Stock,$1.33,-0.07,-5.00%,147387951.00,United States,2019,411332,Health Care,Biotechnology: Pharmaceutical Preparations
DTOC,Digital Transformation Opportunities Corp. Class A Common Stock,$9.86,0.01,0.102%,411038750.00,United States,2021,154986,Industrials,Consumer Electronics/Appliances
DTOCU,Digital Transformation Opportunities Corp. Units,$9.83,-0.03,-0.304%,0.00,United States,2021,483,Industrials,Consumer Electronics/Appliances
DTOCW,Digital Transformation Opportunities Corp. Warrant,$0.0965,-0.0035,-3.50%,0.00,United States,2021,108240,Industrials,Consumer Electronics/Appliances
DTRT,DTRT Health Acquisition Corp. Class A Common Stock,$10.18,0.01,0.098%,292675000.00,United States,2021,2973,Industrials,Consumer Electronics/Appliances
DTRTU,DTRT Health Acquisition Corp. Unit,$10.26,0.03,0.293%,0.00,United States,2021,346,Industrials,Consumer Electronics/Appliances
DTRTW,DTRT Health Acquisition Corp. Warrant,$0.2332,0.00,0.00%,0.00,United States,2021,95,Industrials,Consumer Electronics/Appliances
DTSS,Datasea Inc. Common Stock,$1.4993,0.0293,1.993%,36544887.00,China,,11663,Technology,Retail: Computer Software & Peripheral Equipment
DTST,Data Storage Corporation Common Stock,$2.074,-0.056,-2.629%,14149091.00,United States,,46015,Technology,EDP Services
DTSTW,Data Storage Corporation Warrant,$0.17,0.00,0.00%,0.00,United States,,50,Technology,EDP Services
DUETW,DUET Acquisition Corp. Warrant,$0.035,-0.01,-22.222%,0.00,Malaysia,2022,4400,Miscellaneous,Other Pharmaceuticals
DUNE,Dune Acquisition Corporation Class A Common Stock,$9.7996,-0.0004,-0.004%,53844431.00,United States,2021,4821,Industrials,Consumer Electronics/Appliances
DUNEW,Dune Acquisition Corporation Warrant,$0.049,0.0282,135.577%,0.00,United States,2021,100,Industrials,Consumer Electronics/Appliances
DUO,Fangdd Network Group Ltd. American Depositary Shares,$0.9265,-0.0333,-3.469%,5119107.00,China,2019,1586,Technology,Computer Software: Programming Data Processing
DUOL,Duolingo Inc. Class A Common Stock,$98.30,-0.20,-0.203%,3896231776.00,United States,2021,219993,Technology,Computer Software: Prepackaged Software
DUOT,Duos Technologies Group Inc. Common Stock,$3.65,0.09,2.528%,25273403.00,United States,,3540,Technology,Computer Software: Prepackaged Software
DVAX,Dynavax Technologies Corporation Common Stock,$11.07,0.26,2.405%,1400062597.00,United States,2004,1436372,Health Care,Biotechnology: Pharmaceutical Preparations
DWAC,Digital World Acquisition Corp. Class A Common Stock,$16.01,-1.31,-7.564%,595807891.00,United States,2021,699065,Industrials,Consumer Electronics/Appliances
DWACU,Digital World Acquisition Corp. Units,$18.4998,-1.2602,-6.378%,0.00,United States,2021,2134,Industrials,Consumer Electronics/Appliances
DWACW,Digital World Acquisition Corp. Warrants,$3.405,-0.5945,-14.864%,0.00,United States,2021,107610,Industrials,Consumer Electronics/Appliances
DWSN,Dawson Geophysical Company Common Stock,$1.77,-0.03,-1.667%,42147822.00,United States,,808,Energy,Oil & Gas Production
DXCM,DexCom Inc. Common Stock,$100.22,-1.92,-1.88%,39043885591.00,United States,2005,3158488,Health Care,Medical Specialities
DXLG,Destination XL Group Inc. Common Stock,$5.72,-0.15,-2.555%,353245275.00,United States,,599004,Consumer Discretionary,Clothing/Shoe/Accessory Stores
DXPE,DXP Enterprises Inc. Common Stock,$25.14,0.17,0.681%,473806516.00,United States,,40708,Industrials,Industrial Machinery/Components
DXR,Daxor Corporation Common Stock,$12.0952,-0.8341,-6.451%,48884807.00,United States,,23010,Health Care,Medical/Dental Instruments
DXYN,Dixie Group Inc. (The) Common Stock,$1.05,-0.05,-4.545%,16997792.00,United States,,16741,Consumer Discretionary,Home Furnishings
DYAI,Dyadic International Inc. Common Stock,$1.68,-0.16,-8.696%,47750808.00,United States,,11750,Health Care,Biotechnology: Biological Products (No Diagnostic Substances)
DYN,Dyne Therapeutics Inc. Common Stock,$12.63,-0.09,-0.708%,653796623.00,United States,2020,322522,Health Care, Medicinal Chemicals and Botanical Products 
DYNT,Dynatronics Corporation Common Stock,$0.4469,-0.0431,-8.796%,8303963.00,United States,,49072,Health Care,Medical/Dental Instruments
DZSI,DZS Inc. Common Stock,$11.84,-0.16,-1.333%,330262556.00,United States,,39111,Utilities,Telecommunications Equipment
EA,Electronic Arts Inc. Common Stock,$120.68,-1.63,-1.333%,33554509821.00,United States,,1080062,Consumer Discretionary,Recreational Games/Products/Toys
EAC,Edify Acquisition Corp. Class A Common Stock,$9.90,0.01,0.101%,341550000.00,United States,2021,31520,Industrials,Consumer Electronics/Appliances
EACPU,Edify Acquisition Corp. Units,$9.90,0.00,0.00%,0.00,United States,2021,1200,Industrials,Consumer Electronics/Appliances
EACPW,Edify Acquisition Corp. Warrant,$0.0252,0.0052,26.00%,0.00,United States,2021,500,Industrials,Consumer Electronics/Appliances
EAR,Eargo Inc. Common Stock,$0.709,-0.0121,-1.678%,27942390.00,United States,2020,1111332,Health Care,Medical Specialities
EAST,Eastside Distilling Inc. Common Stock,$0.299,-0.0186,-5.856%,4618562.00,United States,,78177,Consumer Staples,Beverages (Production/Distribution)
EBAC,European Biotech Acquisition Corp. Class A Ordinary Shares,$9.92,0.00,0.00%,162673874.00,Netherlands,2021,2,Finance,Business Services
EBACU,European Biotech Acquisition Corp. Units,$9.93,0.01,0.101%,0.00,Netherlands,2021,1900,Finance,Business Services
EBAY,eBay Inc. Common Stock,$37.56,0.01,0.027%,20634255883.00,United States,1998,5191508,Consumer Discretionary,Catalog/Specialty Distribution
EBC,Eastern Bankshares Inc. Common Stock,$20.12,-0.01,-0.05%,3588281602.00,United States,2020,490700,Finance,Major Banks
EBET,EBET INC. Common Stock,$0.9551,-0.0549,-5.436%,15708685.00,United States,2021,39453,Consumer Discretionary,Services-Misc. Amusement & Recreation
EBIX,Ebix Inc. Common Stock,$18.33,-0.25,-1.346%,566507402.00,United States,,133026,Technology,EDP Services
EBMT,Eagle Bancorp Montana Inc. Common Stock,$18.60,-0.04,-0.215%,149477170.00,United States,2010,1679,Finance,Savings Institutions
EBON,Ebang International Holdings Inc. Class A Ordinary Shares,$0.3627,-0.0243,-6.279%,67961397.00,China,2020,465782,Technology,Semiconductors
EBTC,Enterprise Bancorp Inc Common Stock,$29.46,0.09,0.306%,356915206.00,United States,,6378,Finance,Major Banks
ECBK,ECB Bancorp Inc. Common Stock,$14.98,0.08,0.537%,137445200.00,United States,2022,10024,Finance,Banks
ECOR,electroCore Inc. Common Stock,$0.345,-0.0055,-1.569%,24536772.00,United States,2018,33800,Health Care,Biotechnology: Electromedical & Electrotherapeutic Apparatus
ECPG,Encore Capital Group Inc Common Stock,$46.17,0.13,0.282%,1102566240.00,United States,,174184,,
EDAP,EDAP TMS S.A. American Depositary Shares,$8.095,0.0408,0.507%,292596228.00,France,1997,20786,Health Care,Biotechnology: Electromedical & Electrotherapeutic Apparatus
EDBL,Edible Garden AG Incorporated Common Stock,$0.62,-0.1187,-16.069%,5366063.00,United States,2022,55332,Industrials,Agricultural Chemicals
EDBLW,Edible Garden AG Incorporated Warrant,$0.0895,-0.0005,-0.556%,0.00,United States,2022,150,Industrials,Agricultural Chemicals
EDIT,Editas Medicine Inc. Common Stock,$11.80,-0.20,-1.667%,811099550.00,United States,2016,1201810,Health Care,Biotechnology: Pharmaceutical Preparations
EDNC,Endurance Acquisition Corp. Class A Ordinary Shares,$10.03,0.00,0.00%,250750000.00,United States,2021,1,Finance,Business Services
EDNCU,Endurance Acquisition Corp. Unit,$10.12,0.01,0.099%,0.00,United States,2021,200,Finance,Business Services
EDNCW,Endurance Acquisition Corp. Warrant,$0.2001,-0.0134,-6.276%,0.00,United States,2021,112,Finance,Business Services
EDRY,EuroDry Ltd. Common Shares ,$14.10,-0.72,-4.858%,32495283.00,Greece,,20137,Consumer Discretionary,Marine Transportation
EDSA,Edesa Biotech Inc. Common Shares,$1.06,0.01,0.952%,16390024.00,United States,,66118,Health Care,Pharmaceuticals and Biotechnology
EDTK,Skillful Craftsman Education Technology Limited Ordinary Share,$0.975,0.045,4.839%,15299375.00,China,2020,54676,Real Estate,Other Consumer Services
EDTX,EdtechX Holdings Acquisition Corp. II Class A common stock,$10.15,-0.08,-0.782%,52569682.00,United Kingdom,2021,7988,Industrials,Consumer Electronics/Appliances
EDUC,Educational Development Corporation Common Stock,$2.224,-0.151,-6.358%,19316083.00,United States,,15861,Consumer Discretionary,Books
EEFT,Euronet Worldwide Inc. Common Stock,$75.89,-1.82,-2.342%,3762717116.00,United States,1997,438865,Technology,EDP Services
EEIQ,EpicQuest Education Group International Limited Common Stock,$0.8849,-0.0798,-8.272%,9773997.00,United States,2021,3446,Real Estate,Other Consumer Services
EFHTU,EF Hutton Acquisition Corporation I Unit,$9.97,-0.02,-0.20%,0.00,United States,2022,300,Industrials,Consumer Electronics/Appliances
EFOI,Energy Focus Inc. Common Stock,$0.50,-0.0312,-5.873%,4595154.00,United States,,53925,Consumer Discretionary,Building Products
EFSC,Enterprise Financial Services Corporation Common Stock,$45.59,0.89,1.991%,1696841427.00,United States,,96178,Finance,Major Banks
EFSCP,Enterprise Financial Services Corporation Depositary Shares Each Representing a 1/40th Interest in a Share of 5% Fixed Rate Non-Cumulative Perpetual Preferred Stock Series A,$18.55,0.00,0.00%,0.00,United States,,1,Finance,Major Banks
EFTR,eFFECTOR Therapeutics Inc. Common Stock,$0.60,-0.0342,-5.393%,24871674.00,United States,2021,112009,Health Care,Biotechnology: Pharmaceutical Preparations
EFTRW,eFFECTOR Therapeutics Inc. Warrant,$0.1499,-0.01,-6.254%,0.00,United States,2021,100,Health Care,Biotechnology: Pharmaceutical Preparations
EGAN,eGain Corporation Common Stock,$7.42,0.04,0.542%,236957374.00,United States,1999,64749,Technology,Computer Software: Prepackaged Software
EGBN,Eagle Bancorp Inc. Common Stock,$44.52,0.23,0.519%,1428409286.00,United States,,70023,Finance,Major Banks
EGIO,Edgio Inc. Common Stock,$2.80,-0.13,-4.437%,615197195.00,United States,2007,416384,Technology,Interactive Media
EGLE,Eagle Bulk Shipping Inc. Common Stock,$46.23,-3.40,-6.851%,632948198.00,United States,,324513,Consumer Discretionary,Marine Transportation
EGLX,Enthusiast Gaming Holdings Inc. Common Stock,$0.8538,0.0815,10.553%,128280790.00,Canada,,112244,Miscellaneous,Other Pharmaceuticals
EGRX,Eagle Pharmaceuticals Inc. Common Stock,$26.14,0.09,0.345%,347258372.00,United States,2014,131772,Health Care,Biotechnology: Pharmaceutical Preparations
EH,EHang Holdings Limited ADS,$3.92,-0.06,-1.508%,224793764.00,China,2019,280235,Consumer Discretionary,Air Freight/Delivery Services
EHTH,eHealth Inc. Common Stock,$3.15,-0.18,-5.405%,85860089.00,United States,2006,461339,Finance,Specialty Insurers
EIGR,Eiger BioPharmaceuticals Inc. Common Stock,$5.56,-0.76,-12.025%,244455313.00,United States,2014,314300,Health Care,Biotechnology: Biological Products (No Diagnostic Substances)
EJH,E-Home Household Service Holdings Limited Ordinary Shares,$1.49,-0.1672,-10.089%,8123638.00,China,2021,278436,Consumer Discretionary,Other Consumer Services
EKSO,Ekso Bionics Holdings Inc. Common Stock,$1.56,-0.03,-1.887%,20321527.00,United States,,12149,Health Care,Medical/Dental Instruments
ELBM,Electra Battery Materials Corporation Common Stock,$3.05,-0.01,-0.327%,98735140.00,Canada,,25163,,
ELDN,Eledon Pharmaceuticals Inc. Common Stock,$2.4439,0.0039,0.16%,33620214.00,United States,2014,379970,Health Care,Biotechnology: Pharmaceutical Preparations
ELEV,Elevation Oncology Inc. Common stock,$1.07,-0.05,-4.464%,24931959.00,United States,2021,16836,Health Care,Biotechnology: Pharmaceutical Preparations
ELOX,Eloxx Pharmaceuticals Inc. Common Stock,$0.1898,0.0022,1.173%,16447351.00,United States,,35626,Health Care,Biotechnology: Pharmaceutical Preparations
ELSE,Electro-Sensors Inc. Common Stock,$4.40,-0.10,-2.222%,14973292.00,United States,,2910,Industrials,Industrial Machinery/Components
ELTK,Eltek Ltd. Ordinary Shares,$3.70,0.0069,0.187%,16206992.00,Israel,1997,507,Technology,Electrical Products
ELYM,Eliem Therapeutics Inc Common Stock,$3.25,0.08,2.524%,86344963.00,United States,2021,5004,Health Care,Biotechnology: Pharmaceutical Preparations
ELYS,Elys Game Technology Corp. Common Stock,$0.432,-0.017,-3.786%,7199323.00,United States,,50575,Consumer Discretionary,Movies/Entertainment
EM,Smart Share Global Limited American Depositary Shares,$0.81,-0.01,-1.22%,213383219.00,China,2021,3005,Consumer Discretionary,Other Consumer Services
EMBC,Embecta Corp. Common Stock,$28.38,0.64,2.307%,1641399529.00,United States,,279252,Health Care, Medicinal Chemicals and Botanical Products 
EMBK,Embark Technology Inc. Common Stock,$6.235,-0.605,-8.845%,143612613.00,United States,,133916,Technology,Computer Software: Prepackaged Software
EMBKW,Embark Technology Inc. Warrants,$0.0579,-0.0021,-3.50%,0.00,United States,,30876,Technology,Computer Software: Prepackaged Software
EMCF,Emclaire Financial Corp Common Stock,$31.30,-1.53,-4.66%,85612136.00,United States,,685,Finance,Major Banks
EMCG,Embrace Change Acquisition Corp Ordinary Shares,$10.03,0.01,0.10%,97178132.00,United States,2022,145102,Finance,Business Services
EMCGR,Embrace Change Acquisition Corp Rights,$0.09,-0.01,-10.00%,0.00,United States,2022,25000,Finance,Business Services
EMCGU,Embrace Change Acquisition Corp Unit,$10.12,-0.03,-0.296%,0.00,United States,2022,29444,Finance,Business Services
EMCGW,Embrace Change Acquisition Corp Warrants,$0.04,0.00,0.00%,0.00,United States,2022,50000,Finance,Business Services
EMKR,EMCORE Corporation Common Stock,$1.49,-0.14,-8.589%,55949358.00,United States,1997,850939,Technology,Semiconductors
EML,Eastern Company (The) Common Stock,$18.52,0.16,0.871%,115141877.00,United States,,8738,Industrials,Industrial Specialties
EMLD,FTAC Emerald Acquisition Corp. Class A Common Stock,$9.83,0.00,0.00%,338747344.00,United States,2022,55633,Industrials,Consumer Electronics/Appliances
EMLDU,FTAC Emerald Acquisition Corp. Unit,$9.88,0.04,0.407%,0.00,United States,2021,400,Industrials,Consumer Electronics/Appliances
EMLDW,FTAC Emerald Acquisition Corp. Warrant,$0.13,0.00,0.00%,0.00,United States,2022,77,Industrials,Consumer Electronics/Appliances
ENCP,Energem Corp Class A Ordinary Shares,$10.17,0.00,0.00%,151564273.00,Malaysia,2022,1318,Finance,Business Services
ENCPU,Energem Corp Unit,$10.20,0.00,0.00%,0.00,Malaysia,2021,1,Finance,Business Services
ENCPW,Energem Corp Warrant,$0.0748,0.00,0.00%,0.00,Malaysia,2022,595,Finance,Business Services
ENER,Accretion Acquisition Corp. Common Stock,$9.95,0.04,0.404%,258650250.00,United States,2021,2020,Industrials,Consumer Electronics/Appliances
ENERR,Accretion Acquisition Corp. Right,$0.0722,-0.0072,-9.068%,0.00,United States,2021,250,Finance,Business Services
ENERU,Accretion Acquisition Corp. Unit,$9.97,0.02,0.201%,0.00,United States,2021,6800,Industrials,Consumer Electronics/Appliances
ENERW,Accretion Acquisition Corp. Warrant,$0.0362,0.0062,20.667%,0.00,United States,2021,400,Industrials,Consumer Electronics/Appliances
ENG,ENGlobal Corporation Common Stock,$1.17,-0.09,-7.143%,41888706.00,United States,,118350,Consumer Discretionary,Military/Government/Technical
ENLV,Enlivex Therapeutics Ltd. Ordinary Shares,$4.22,-0.04,-0.939%,56817114.00,Israel,2014,14536,Health Care,Biotechnology: Pharmaceutical Preparations
ENOB,Enochian Biosciences Inc. Common Stock,$1.72,0.075,4.559%,91073943.00,United States,,40237,Health Care,Biotechnology: Pharmaceutical Preparations
ENPH,Enphase Energy Inc. Common Stock,$258.18,3.03,1.188%,34972359260.00,United States,2012,3519979,Technology,Electrical Products
ENSC,Ensysce Biosciences Inc. Common Stock,$0.215,-0.005,-2.273%,8251249.00,United States,,200311,Health Care,Biotechnology: Pharmaceutical Preparations
ENSG,The Ensign Group Inc. Common Stock,$85.38,2.88,3.491%,4720651918.00,United States,2007,332788,Health Care,Hospital/Nursing Management
ENTA,Enanta Pharmaceuticals Inc. Common Stock,$48.49,0.18,0.373%,1004948849.00,United States,2013,166459,Health Care,Biotechnology: In Vitro & In Vivo Diagnostic Substances
